{
  "schema_version": "brandbench-review.v1",
  "review_id": "brandbench-phase0-pending",
  "review_status": "pending",
  "fixture_id": "G-16",
  "candidate_order": ["A", "B"],
  "dimensions": ["战略锋利度", "自然中文", "消费者真实", "记忆性", "产品咬合度", "证据纪律"],
  "scores": [
    {"candidate":"A","dimension":"战略锋利度","score":null,"comment":""}, {"candidate":"A","dimension":"自然中文","score":null,"comment":""},
    {"candidate":"A","dimension":"消费者真实","score":null,"comment":""}, {"candidate":"A","dimension":"记忆性","score":null,"comment":""},
    {"candidate":"A","dimension":"产品咬合度","score":null,"comment":""}, {"candidate":"A","dimension":"证据纪律","score":null,"comment":""},
    {"candidate":"B","dimension":"战略锋利度","score":null,"comment":""}, {"candidate":"B","dimension":"自然中文","score":null,"comment":""},
    {"candidate":"B","dimension":"消费者真实","score":null,"comment":""}, {"candidate":"B","dimension":"记忆性","score":null,"comment":""},
    {"candidate":"B","dimension":"产品咬合度","score":null,"comment":""}, {"candidate":"B","dimension":"证据纪律","score":null,"comment":""}
  ],
  "reviewer_confirmation": {"reviewed_by":null,"model_identity_hidden":true,"order_randomized":false,"confirmed_at":null}
}
